Animal,Date,Session,User,Exclude?,Ephys?,First World,Last World,Total Trials,Percent Correct,Total Rewards,Trial rate,Time Elapsed,Notes,
S17,210331,2,Steph,0,0,ymazeSurprise,ymazeSurprise,26,46.15384615,14,2.214166693,708.3617161,Not so great second session,
S17,210331,2,Steph,0,0,ymazeSurprise,ymazeSurprise,45,82.5,34,2.286078123,1184.809309,much better in second session on delay no update,
S18,210331,1,Steph,0,0,ymazeSurprise,ymazeShort,113,47.5,45,2.637349301,2577.1944,when did ymaze short did well for a tiny bit but overall not great,
S19,210331,1,Steph,0,0,ymazeSurprise,ymazeSurprise,135,65,89,20.52269531,4003.145195,took a lot of involvement but did better for a bit today,
S20,210401,1,Navya,0,0,ymazeSurprise,ymazeSurprise,49,42.5,19,0.818778889,3602.497897,tried warmup but didnt really help. not much proress.,
S17,210401,1,Steph,0,0,ymazeSurprise,ymazeSurprise,51,55,30,2.228021226,1391.354725,maybe slightly better initial session after the waiting period than usual? going to pause at 20 and see,
S17,210401,2,Steph,0,0,ymazeSurprise,ymazeSurprise,49,40,22,2.145280747,1395.613626,Not great,
S19,210401,1,Steph,0,0,ymazeSurprise,ymazeSurprise,32,59.375,19,2.366032644,840.8379975,Good first 15 min then started to drop a bit so putting on bias correction,
S19,210401,2,Steph,0,0,ymazeSurprise,ymazeSurprise,82,32.5,39,1.972979801,2502.799325,Better at first but declined at the end,
S20,210402,1,Navya,0,0,ymazeSurprise,ymazeSurprise,37,59.45945946,22,16.5623438,3736.873437,did ok, moving more accurately but still not enough to move to next level.
S17,210402,1,Steph,0,0,ymazeSurprise,ymazeSurprise,36,69.44444444,26,2.27404327,958.912193,better his tail was stuck though,
S17,210402,2,Steph,0,0,ymazeSurprise,ymazeSurprise,26,50,13,2.243439019,722.4532202,Ok at first in second session but then fell off a bit so doing a brief pause at 30 min total,
S17,210402,3,Steph,0,0,ymazeSurprise,ymazeSurprise,50,52.5,28,2.263095402,1330.020687,ok job overall managed to stay just above chance for most of the session,
S1,210402,1,Steph,0,0,ymazeSurprise,ymazeLong,18,11.11111111,2,1.669699439,653.9662561,,
S1,210402,1,Steph,0,0,ymazeSurprise,ymazeShort,58,17.5,15,2.659604957,1315.52048,,
S19,210402,2,Steph,0,0,ymazeSurprise,ymazeSurprise,69,60,36,2.267043485,1854.67025,slightly better second sesison. Forgot this guy likes to either start with a warmup or get corrected on bias right away,
S1,210404,1,Steph,0,0,ymazeSurprise,ymazeSurprise,0,0,0,0,16.6087144,,
S1,210404,1,Steph,0,0,ymazeSurprise,ymazeSurprise,5,80,4,2.104908647,143.2216719,,
S17,210404,1,Steph,0,0,ymazeSurprise,ymazeSurprise,39,43.58974359,20,2.131815432,1098.695788,Not so great,
S17,210404,2,Steph,0,0,ymazeSurprise,ymazeSurprise,61,65,45,2.237511203,1657.492886,Better second session but started to fall off at the end,
S20,210404,1,Steph,0,0,ymazeSurprise,ymazeSurprise,59,55,38,1.724151367,2074.262021,Did really well the first 30 min but fell off towards the end so did a pause and took off,
S20,210405,1,Navya,0,0,ymazeSurprise,ymazeSurprise,83,17.5,39,402.3267087,3614.954565,started doing really well and dipped off and got bad. not sure why. ,
S17,210405,1,Steph,0,0,ymazeSurprise,ymazeSurprise,67,60,43,2.272593651,1799.348129,did ok but started getting super biased towards 30 min in so stopped,
S17,210405,2,Steph,0,0,ymazeSurprise,ymazeSurprise,29,62.06896552,18,2.114886981,843.2574488,second session ok but fell off faster,
S19,210405,1,Steph,0,0,ymazeLong,ymazeSurprise,36,61.11111111,23,1.993421708,1120.317419,did well in the first 15 min but fell off towards 20 so did a pause,
S19,210405,2,Steph,0,0,ymazeLong,ymazeSurprise,90,82.5,71,2.357617374,2295.383575,Great job in the second session,
S20,210406,1,Navya,0,0,ymazeSurprise,ymazeSurprise,81,62.5,65,1.36045624,3576.268397,good job dropped off around 40,
S17,210406,1,Steph,0,0,ymazeSurprise,ymazeSurprise,59,80,49,1.823726997,1968.872502,first session! had a few decent trials but started to drop off at 30 min so taking a pause,
S17,210406,2,Steph,0,0,ymazeSurprise,ymazeSurprise,11,54.54545455,6,1.802697491,380.6991415,spikegadgets errored out,
S1,210406,1,Steph,0,0,ymazeSurprise,ymazeSurprise,8,25,2,2.30951327,235.105567,,
S19,210406,2,Steph,0,0,ymazeSurprise,ymazeSurprise,121,77.5,83,2.181114195,3354.275776,Good session switched to later delay,
S20,210407,1,Navya,0,0,ymazeSurprise,ymazeSurprise,96,75,82,1.657012269,3487.311169,did amazing on first day of later delay.,
S17,210407,1,Steph,0,0,ymazeSurprise,ymazeSurprise,45,45,22,1.927463137,1412.922534,Recording 1 not great behavior and taking a pause bc he was pretty biased,
S17,210407,3,Steph,0,0,ymazeSurprise,ymazeSurprise,49,52.5,27,1.901360766,1574.313735,Got a few decent trials but performance started to drop off at the end,
S19,210407,1,Steph,0,0,ymazeSurprise,ymazeSurprise,67,62.5,43,1.860689872,2164.763768,Did decent at first but started falling off at 35 min so took a pause,
S19,210407,2,Steph,0,0,ymazeSurprise,ymazeSurprise,35,57.14285714,21,2.155362645,997.9527707,did ok for a bit in the second session but then dropped off,
S20,210408,1,Navya,0,0,ymazeSurprise,ymazeSurprise,47,77.5,35,0.793821032,3561.684301,did well on later delay so great. lots of progress,
S17,210408,1,Steph,0,0,ymazeSurprise,ymazeSurprise,47,57.5,26,1.727318834,1639.566521,Ok first session stayed above chance but got more biased at the end,
S17,210408,3,Steph,0,0,ymazeSurprise,ymazeSurprise,52,57.5,33,1.670364311,1879.352798,Better job in the second session did decent but still biased,
S19,210408,1,Steph,0,0,ymazeSurprise,ymazeSurprise,23,30.43478261,8,2.022339524,687.5447101,Bad start changing the bias correction max,
S19,210408,2,Steph,0,0,ymazeSurprise,ymazeSurprise,30,46.66666667,15,2.231816277,820.2821875,Better start to second session but fell off eventually,
S20,210409,1,Navya,0,0,ymazeSurprise,ymazeSurprise,85,42.5,53,1.422569937,3591.355705,did pretty well for first day on middle delay. ,
S17,210409,1,Steph,0,0,ymazeSurprise,ymazeSurprise,92,62.5,68,2.057417605,2696.397898,AMAZING BEHAVIOR SESSION DURING A RECORDING. Great job overall,
S17,210410,1,Steph,0,0,ymazeSurprise,ymazeSurprise,13,61.53846154,8,1.910074664,417.0784609,Great job but was getting stuck on update trials in a row idk,
S17,210410,2,Steph,0,0,ymazeSurprise,ymazeSurprise,50,57.5,28,1.963508843,1547.719306,Not so great hovered aruond or just above chance and had an opposite side bias as usual,
S20,210412,1,Steph,0,0,ymazeSurprise,ymazeSurprise,19,42.10526316,9,1.872431566,612.4000472,Started off a bit biased so doing a little pause,
S20,210412,2,Steph,0,0,ymazeSurprise,ymazeSurprise,94,92.5,71,2.120774338,2662.432846,Great job in second session after a bit of a rough start,
S17,210412,1,Steph,0,0,ymazeSurprise,ymazeSurprise,55,52.5,31,1.92434973,1720.074625,Decent job just fell off after about 30 min ,
S17,210412,1,Steph,0,0,ymazeSurprise,ymazeSurprise,8,87.5,7,1.767936266,293.5012156,got stuck in that weird update task loop,
S17,210412,3,Steph,0,0,ymazeSurprise,ymazeSurprise,8,25,2,1.693683267,288.4613582,only a few minutes to see if he would keep going but didn't,
S20,210413,1,Navya,0,0,ymazeSurprise,ymazeSurprise,28,25,7,0.653607994,2735.86391,not doing well. will retsart again.,
S20,210413,2,Navya,0,0,ymazeSurprise,ymazeSurprise,1,100,1,0.063328281,956.6896563,did mot do very well on second round. will keep on middle delay. ,
S17,210413,2,Steph,0,0,ymazeSurprise,ymazeSurprise,47,47.5,24,2.128703529,1327.44324,did ok but not great. started to drop off after 20 min so doing a pause,
S17,210413,5,Steph,0,0,ymazeSurprise,ymazeSurprise,49,57.5,28,2.132404939,1380.516371,Ok but not great on update part of the task,
S19,210413,2,Steph,0,0,ymazeSurprise,ymazeSurprise,31,45.16129032,17,2.395727876,787.7842725,Did ok for a bit but fell off after about 15 min so doing a brief brief pause,
S20,210414,1,Navya,0,0,ymazeSurprise,ymazeSurprise,80,40,22,46.74034763,3875.339712,did much better today but still needs improvement,
S17,210414,1,Steph,0,0,ymazeSurprise,ymazeSurprise,25,52,13,1.984168977,770.7301645,Not great fell into bias pretty quick but also was above 85 weight,
S17,210414,3,Steph,0,0,ymazeSurprise,ymazeSurprise,15,60,9,1.984652024,454.6798664,Ok not great,
S17,210414,4,Steph,0,0,ymazeSurprise,ymazeSurprise,60,50,28,2.038755612,1789.714134,Mainly below chance but maybe had a few good spurts here and there,
S19,210414,1,Steph,0,0,ymazeSurprise,ymazeSurprise,149,57.5,58,25.3594,3973.103146,Finally got to above chance on the later delay at the end! Took forever to get there though,
S20,210415,1,Navya,0,0,ymazeSurprise,ymazeSurprise,58,30,22,0.986136284,3537.900646,still didnt do great. maybe will try new technique with warmup.,
S17,210415,1,Steph,0,0,ymazeSurprise,ymazeSurprise,33,39.39393939,14,2.179500586,910.8359525,Not good,
S17,210415,3,Steph,0,0,ymazeSurprise,ymazeSurprise,69,52.5,35,2.23231497,1858.297013,not great maybe one or two update trials and bad performance overall,
S19,210415,1,Steph,0,0,ymazeSurprise,ymazeSurprise,146,7.5,30,2.503421486,3519.39436,So so bad,
S20,210416,1,Navya,0,0,ymazeSurprise,ymazeSurprise,88,35,37,1.498098011,3532.092904,did worse today, but did lots of trials and inconsistent performance.
S17,210416,1,Steph,0,0,ymazeSurprise,ymazeSurprise,184,52.5,103,9.405053683,4795.345119,No recording today. Better than previous days but not great on update trials,
S19,210416,1,Steph,0,0,ymazeSurprise,ymazeSurprise,52,27.5,20,2.142430423,1459.900837,Bad bad ,
S19,210418,1,Steph,0,0,ymazeSurprise,ymazeSurprise,71,40,35,1.921281576,2242.057511,Not great but was trying. Doing a brief pause at 37 min,
S19,210418,2,Steph,0,0,ymazeSurprise,ymazeSurprise,52,47.5,23,1.891984656,1659.322991,hovered around 50 percent again,
S19,210418,1,Steph,0,0,ymazeSurprise,ymazeSurprise,125,67.5,103,2.657072862,2850.982778,Did really really well at the beginning. Switched to middle delay at 36 min and dropped off a bit after that,
S1,210419,1,Steph,0,0,ymazeSurprise,ymazeSurprise,51,30,21,0.868636352,3529.236119,,
S19,210419,1,Steph,0,0,ymazeSurprise,ymazeSurprise,86,67.5,43,2.373759469,2189.889156,Ugh rough day but FINALLY did better at the end,
S20,210420,1,Navya,0,0,ymazeLong,ymazeSurprise,86,57.5,51,1.469422346,3518.496368,little better than yesterday. still has lots of work to do. ,
S19,210420,1,Steph,0,0,ymazeLong,ymazeLong,52,7.5,12,2.629527401,1189.763552,horrible horrible,
S20,210421,1,Navya,0,0,ymazeLong,ymazeSurprise,119,55,71,127.4294587,3665.487631,promising improvement. give longer warm up time. ,
S20,210422,1,Navya,0,0,ymazeLong,ymazeSurprise,89,72.5,73,202.8644152,3637.830374,much better today. will continue on middle delay.,
S19,210422,1,Steph,0,0,ymazeLong,ymazeLong,25,48,14,2.774084136,561.9929465,think the bias correction was wonky need to fix,
S19,210422,2,Steph,0,0,ymazeLong,ymazeLong,56,5,3,3.036555245,1119.025055,horrible,
S20,210423,1,Navya,0,0,ymazeLong,ymazeSurprise,104,47.5,46,1.829246307,3417.219125,did worse than yesterday but got better after dip.,
S20,210425,1,Steph,0,0,ymazeLong,ymazeSurprise,150,85,123,53.40517318,3772.221504,Great job!! 85% most of the time,
S20,210426,1,Steph,0,0,ymazeLong,ymazeSurprise,133,67.5,97,324.6806087,3631.054452,Good job! First day trying the update he didn't get it but stayed above chance performance the whole tim estill,
S20,210427,1,Steph,0,0,ymazeLong,ymazeSurprise,134,67.5,103,2.317646079,3470.428244,Great job! Above chance on update with earlier delay for a bit fell off at very end but otherwise good,
S20,210428,1,Steph,0,0,ymazeLong,ymazeSurprise,130,55,100,2.406167934,3251.002279,Good job overall but fell off at the end. Did really well on update to start and had done a 5 min pre-behavior delay for recording habituation,
S20,210429,1,Steph,0,0,ymazeLong,ymazeSurprise,142,52.5,107,126.6556661,3670.951298,A 10 min pre behavior delay and overweight so he was doing fine but with a bit of side bias on the delay task but didn't really get the update trials,
S20,210430,1,Steph,0,0,ymazeLong,ymazeSurprise,133,62.5,100,2.41348357,3341.091707,Stayed above chance on task the whole time but did not do great on the update still at 10 min warmup pause,
S1,210502,1,Steph,0,0,ymazeLong,ymazeLong,0,0,0,0,10.7255147,,
S20,210502,1,Steph,0,0,ymazeLong,ymazeSurprise,188,80,142,12.08772603,4572.013036,Decent job overall was finally doing update trials well at the end but took a while to get there,
S20,210503,1,Steph,0,0,ymazeLong,ymazeSurprise,138,47.5,97,2.42388333,3426.756406,Did 15 min pre behavior and motor moving. Was doing excellent on the warmup but not so great on the update task. Will retry habituation tomorrow,
S20,210504,1,Steph,0,0,ymazeLong,ymazeSurprise,111,57.5,84,2.257757227,2967.747533,lasted longer on the normal task and did ok on a few update trials but got confused and fell off eventually,
S20,210505,1,Steph,0,0,ymazeLong,ymazeSurprise,163,85,136,202.3839086,3652.775818,Great job overall and with the 20 min delay with shielding. Did great on update too,
S20,210506,1,Steph,0,0,ymazeLong,ymazeSurprise,122,57.5,95,2.60191639,2846.388489,Not great today did really well with warmup but fell off pretty quickly into side bias,
S20,210507,1,Steph,0,0,ymazeLong,ymazeSurprise,67,82.5,55,2.690680207,1532.647799,Did decent at first but them got biased so doing a brief pause,
S20,210507,2,Steph,0,0,ymazeSurprise,ymazeSurprise,70,87.5,63,2.62741558,1599.278139,Awesome second session! Did very well on update too,
S20,210509,1,Steph,0,0,ymazeLong,ymazeSurprise,77,72.5,58,1.692792587,2770.47015,Good job overall! Above chance on update pausing at 45 min for a brief bit,
S20,210509,2,Steph,0,0,ymazeLong,ymazeSurprise,76,92.5,67,1.605056774,2854.599448,Great job! Did really really well ,
S20,210510,1,Steph,0,0,ymazeLong,ymazeSurprise,88,70,70,2.063489024,2568.544225,Great job! started falling off at end so did a pause but 100 percent on the update!,
S20,210510,2,Steph,0,0,ymazeLong,ymazeSurprise,27,40.74074074,12,1.805444418,907.3959852,Not so great session so stopped after 15 min to pull back up,
S20,210511,1,Steph,0,0,ymazeLong,ymazeSurprise,135,80,112,41.58601888,3804.951056,Great job,
S20,210511,2,Steph,0,0,ymazeSurprise,ymazeSurprise,67,65,51,1.866482433,2189.632774,good job didn't last as long but did ok,
S20,210511,5,Steph,0,0,ymazeLong,ymazeSurprise,99,77.5,80,2.13226122,2794.55889,Great job yet again!,
S20,210512,1,Steph,0,0,ymazeLong,ymazeSurprise,81,72.5,66,2.005816869,2517.487188,Good job overall above chance on update just got pretty biased around 35 or 40 min ibn,
S20,210512,2,Steph,0,0,ymazeLong,ymazeSurprise,54,57.5,36,1.750799613,1878.500144,Did not last very long but ok overall,
S20,210513,1,Steph,0,0,ymazeLong,ymazeSurprise,124,90,114,90.30660549,3690.236333,Great job,
S20,210513,2,Steph,0,0,ymazeSurprise,ymazeSurprise,3,66.66666667,2,1.514463123,152.5031563,dont use only a few trials,
S20,210513,4,Steph,0,0,ymazeLong,ymazeSurprise,32,62.5,20,1.917807946,1044.363045,Not great behavior took off pretty quick,
S20,210514,1,Steph,0,0,ymazeLong,ymazeSurprise,47,82.5,40,2.075747103,1460.062195,ok job but fell into bias quickly,
S20,210514,3,Steph,0,0,ymazeLong,ymazeSurprise,26,53.84615385,15,1.705477206,932.1938717,exclude bc I;m not sure he was getting rewards,
S20,210516,1,Steph,0,0,ymazeLong,ymazeSurprise,116,67.5,90,33.70704894,3814.174903,Good job in the task overall but not great on the update,
S20,210516,3,Steph,0,0,ymazeLong,ymazeSurprise,54,77.5,42,1.895462882,1712.546064,Better on update but developed a bias so stopped,
S23,210517,1,Navya,0,0,linear,linear,15,100,15,0.504144347,1871.10934,first day and did pretty well in terms of acclimation.,
S20,210517,1,Steph,0,0,ymazeLong,ymazeSurprise,53,57.5,35,1.29711209,2465.948129,not great fell off in percent correct once I got to the update task and below chance,
S20,210517,3,Steph,0,0,ymazeLong,ymazeSurprise,86,60,60,15.40776838,3952.704525,Much better session! Still biased but did the update trials well,
S23,210518,1,Navya,0,0,linear,linear,8,87.5,10,0.19165571,2915.195815,tried giving additional rewards but was not motivated. licking well though. ,
S20,210518,1,Steph,0,0,ymazeLong,ymazeSurprise,44,47.5,23,1.715384006,1555.260328,Not good really struggled with the warmup,
S20,210518,3,Steph,0,0,ymazeLong,ymazeSurprise,106,45,54,21414.14141,3617.858048,still not great behavior,
S23,210519,1,Navya,0,0,linear,linear,53,100,54,0.887785826,3586.56423,started off very slow and unmotivated. offered extra rewards. will continue linear maze. ,
S20,210519,1,Steph,0,0,ymazeLong,ymazeSurprise,6,100,6,2.170727736,234.2623242,bad first session aborted quickly,
S20,210519,3,Steph,0,0,ymazeLong,ymazeSurprise,137,67.5,104,5.629971172,5075.35163,Muchhh better second session and lasted for a while too,
S23,210520,1,Navya,0,0,linear,linear,146,100,147,2.437823669,3595.871188,amazing job. moving onto ymaze tommorow. ,
S20,210520,1,Steph,0,0,ymazeLong,ymazeSurprise,56,67.5,42,1.865148643,1810.606745,ok not great. Like was above chance on the main task but not on updates,
S20,210520,3,Steph,0,0,ymazeLong,ymazeSurprise,89,65,67,1.662550246,3222.61512,better overall than previous session but fell off eventually,
S23,210521,1,Navya,0,0,ymazeLong,ymazeShort,146,25,52,991.0623374,3618.928687,used linear long warmup. started to correct bias near end. ,
S20,210521,1,Steph,0,0,ymazeLong,ymazeSurprise,15,66.66666667,10,1.892493739,483.5492006,went in to bias so stopped pretty quickly and doing a pause,
S20,210521,3,Steph,0,0,ymazeLong,ymazeSurprise,65,65,49,1.569957929,2538.876657,slightly better than the first session but not the best,
S23,210524,1,Navya,0,0,linear,ymazeShort,67,62.5,43,506.1697305,3614.002332,did well and corrected side bias. will keep on short for one more day. ,
S23,210525,1,Navya,0,0,linear,ymazeShort,97,82.5,70,1.629131788,3578.560958,struggled at first but did better. medium maze tmr. ,
S23,210525,1,Steph,0,0,linear,linear,42,100,42,1.39517502,1902.476067,Good job first day! 42 trials in 30 min and got up to medium length,
S25,210525,1,Steph,0,0,linear,linear,19,94.73684211,18,0.573926807,1997.080126,Good job started picking it up at the end first day on the ball,
S23,210526,1,Navya,0,0,ymazeShort,ymazeLong,92,95,77,56.55563866,3782.147606,did great on ymazelong. hopefully more trials tommorow. ,
S25,210526,1,Steph,0,0,linear,linear,85,100,84,1.895159762,2708.890297,Good job! Ran faster today and got up to the long maze. no licks detected,
S23,210527,1,Navya,0,0,ymazeShort,ymazeLong,38,65.78947368,27,0.678975581,3761.533845,didnt do as well today. keep on ymazelong.,
S24,210527,1,Steph,0,0,linear,linear,78,100,78,1.586114315,3110.964256,Slightly better than yesterday but just very slow moving overall,
S25,210527,1,Steph,0,0,linear,linear,131,100,131,2.796495202,2825.193404,Good job licks recorded switch to ymazeShort tomorrow,
S23,210528,1,Navya,0,0,ymazeShort,ymazeLong,119,82.5,74,187.6971609,3748.211845,much better today. one more day on long maze before trying delay. ,
S24,210528,1,Steph,0,0,linear,ymazeShort,147,70,95,48.47325727,3894.754421,Good job overall maybe was getting better at the ymaze but hard to tell for sure,
S25,210528,1,Steph,0,0,linear,ymazeShort,191,67.5,114,32.30352915,3958.456478,Great job! seemed to be maybe getting it at the end and it was only the first day of the ymaze short,
S23,210531,1,Steph,0,0,ymazeLong,ymazeSurprise,87,60,61,1.53256975,3565.295148,Great job on the ymaze long and started maybe getting better at delay,
S24,210531,1,Steph,0,0,ymazeShort,ymazeShort,178,72.5,125,6798.217696,3611.453504,good job and did above chance on ymaze short for the first time,
S25,210531,1,Steph,0,0,ymazeShort,ymazeShort,205,87.5,118,192.3257341,3677.374217,Ok not great on ymaze short,
S23,210601,1,Navya,0,0,ymazeLong,ymazeLong,30,53.33333333,16,20.05727466,3697.659007,only did ymazelong. not very motivated.,
S25,210601,1,Steph,0,0,ymazeShort,ymazeShort,127,55,77,2.991873647,2566.279837,not great so paused after 42 min,
S24,210601,1,Steph,0,0,ymazeShort,ymazeShort,76,52.5,37,3.006941683,1517.253088,actually his first session need to rename. Doing a pause bc he was donig bad,
S24,210601,2,Steph,0,0,ymazeShort,ymazeShort,86,62.5,64,3.06011162290885,1702.9241703,better in second session but falling off at the end
S23,210602,1,Navya,0,0,ymazeLong,ymazeSurprise,23,65.2173913043478,17,0.415983408893605,3977.4839633,didnt do great, still not motivated on the ball.
S24,210602,1,Steph,0,0,ymazeShort,ymazeLong,136,32.5,88,2.4358557973368,3368.1301848,did well on the short ymaze so transitioned to long and didn't do so well in that
S25,210602,1,Steph,0,0,ymazeShort,ymazeShort,66,52.5,34,2.95359499499903,1368.1529288,not great first session maybe a tiny bit above chance so stopped after 20 min
S25,210602,2,Steph,0,0,ymazeShort,ymazeShort,138,65,69,3.23817859493554,2558.0973802,got up to 65 percent in the second session so seemed to be donig better
S23,210603,1,Navya,0,0,ymazeLong,ymazeSurprise,45,80,38,143.334925943622,3629.5177948,did better on delay and had high accuracy. did not complete many trials though. 
S24,210603,1,Steph,0,0,ymazeLong,ymazeLong,70,27.5,26,2.28501665613927,1851.2515071,not well in first session so did a pause
S24,210603,2,Steph,0,0,ymazeLong,ymazeLong,63,42.5,29,2.52754894618594,1510.362065,Closer to 50 percent in second session but really not great overall
S25,210603,1,Steph,0,0,ymazeShort,ymazeShort,227,85,144,69.4614443084455,3800.9146371,Good job some low bouts but ended at 85 percent correct
S23,210604,1,Navya,0,0,ymazeLong,ymazeSurprise,40,25,12,0.698582372612777,3450.4743502,very slow today. did not do well.
S24,210604,1,Steph,0,0,ymazeLong,ymazeLong,54,37.5,27,2.73961946347428,1187.5012498,did well at first and then completely dropped off
S24,210604,2,Steph,0,0,ymazeLong,ymazeLong,94,97.5,90,2.78693166236026,2025.4012327,awesome job in the second session pretty much at 100 percent!
S25,210604,1,Steph,0,0,ymazeShort,ymazeShort,224,77.5,177,68.5766767864888,3798.6420037,Slow start but ended up doing really well! Will switch to ymaze long on monday if he does well on short at the beginning
S23,210607,1,Navya,0,0,ymazeLong,ymazeLong,45,35,17,54.0216086434574,3727.6070612,not do well. very demotivated.
S24,210607,1,Steph,0,0,ymazeLong,ymazeLong,127,87.5,101,65.1309885037822,3722.3838261,great job got up to around 90 on the long ymaze looking good
S25,210607,1,Steph,0,0,ymazeShort,ymazeLong,202,75,175,22.9568063521407,4130.0230103,transitioned to the ymaze and he did really well
S23,210608,1,Navya,0,0,ymazeLong,ymazeLong,35,45.7142857142857,17,12.7820418398836,3798.8521538,did slightly better than yesterday but still not great.
S24,210608,1,Steph,0,0,ymazeLong,ymazeSurprise,97,52.5,71,2.02847957439571,2920.0259867,switched to delay today. Did ok at first but then kinda fell off so did a 10 min break at the end
S25,210608,1,Steph,0,0,ymazeLong,ymazeLong,174,97.5,168,63.8286164963959,3765.9149375,amazing job on ymazeLong like close to 100 percent the whole time
S23,210609,1,Navya,0,0,ymazeLong,ymazeSurprise,31,67.741935483871,22,0.517868697454425,3688.7277975,did much better today. still slow and staying on ball sometimes.
S24,210609,1,Steph,0,0,ymazeLong,ymazeSurprise,119,62.5,89,253.299276287782,3641.4118881,Decent job. Transitioned to delay again and he lasted decently long
S25,210609,1,Steph,0,0,ymazeLong,ymazeSurprise,98,65,81,2.35163032371311,2548.2321456,switched to laatest delay bc he was doing super well and he lasted like 20 min but then started spinning so taking a pause
S23,210610,1,Navya,0,0,ymazeLong,ymazeSurprise,11,81.8181818181818,9,0.232732648017964,4246.5930726,stll stuck on ball. accuracy still good.
S24,210610,1,Steph,0,0,ymazeSurprise,ymazeSurprise,40,12.5,7,1.29389749420577,1854.8986339,so so bad today.
S25,210610,1,Steph,0,0,ymazeLong,ymazeSurprise,136,80,108,76.9716921509626,3709.552326,good job on the latest delay little buddy!
S23,210611,1,Navya,0,0,ymazeLong,ymazeSurprise,24,54.1666666666667,15,4.05703515251917,3974.1028508,knows the task but wont move.
S24,210611,1,Steph,0,0,ymazeLong,ymazeLong,72,77.5,41,1.77508519998061,2462.8529492,Finallyyyy climbed up a bit after I moved the lick detector a little but then started falling off again at 41 min so did a pause
S25,210611,1,Steph,0,0,ymazeLong,ymazeSurprise,151,95,143,2.51875163329645,3601.3778467,Amazing job and I even moved him to the later delay
S23,210613,1,Steph,0,0,ymazeLong,ymazeLong,15,46.6666666666667,7,1.58735757875057,833.3866648,did a puase after 10 min bc he wasn't really trying
S23,210613,2,Steph,0,0,ymazeLong,ymazeSurprise,43,55,23,1.18443269805505,2180.6566354,slightly better in the second session and stayed above chance for 40 trials
S23,210614,1,Navya,0,0,ymazeLong,ymazeSurprise,5,60,3,0.456121145776318,1250.2777407,going to restart
S23,210614,1,Navya,0,0,ymazeLong,ymazeSurprise,10,50,6,0.2015815415814,3100.5619611,did not do well but that was expected.
S24,210614,1,Steph,0,0,ymazeLong,ymazeLong,54,60,28,1.72678342351868,1884.298855,bad at first. Changed bias correction and started doing ok. Then did bad again so took a pause
S24,210614,2,Steph,0,0,ymazeLong,ymazeLong,40,7.5,4,1.94074579626374,1253.433074,so bad in the second session 
S25,210614,1,Steph,0,0,ymazeSurprise,ymazeSurprise,134,90,110,97.0100629841454,3683.7571492,slow start but awesome job on later delay
S23,210615,1,Navya,0,0,ymazeSurprise,ymazeSurprise,6,33.3333333333333,2,0.11525816387982,3632.6509137,very slow only 6 trials. not good.
S24,210615,2,Steph,0,0,ymazeLong,ymazeSurprise,36,63.8888888888889,23,1.75744207560418,1255.6677878,did much much better on ymaze long but hated the transition to delay
S25,210615,1,Steph,0,0,ymazeSurprise,ymazeSurprise,140,72.5,90,30.2227851016061,3884.9886831,slow start bc went on delay to start but got a lot better eventually
